{
	"$schema": "http://json-schema.org/draft-04/schema#",
	"type": "object",
	"properties": {
		"name": {
			"type": "string"
		},
		"model": {
			"type": "string"
		},
		"manufacturer": {
			"type": "string"
		},
		"cost_in_credits": {
			"type": "string"
		},
		"length": {
			"type": "string"
		},
		"max_atmosphering_speed": {
			"type": "string"
		},
		"crew": {
			"type": "string"
		},
		"passengers": {
			"type": "string"
		},
		"cargo_capacity": {
			"type": "string"
		},
		"consumables": {
			"type": "string"
		},
		"vehicle_class": {
			"type": "string"
		},
		"pilots": {
			"type": "array",
			"items": [
				{
					"type": "string"
				}
			]
		},
		"films": {
			"type": "array",
			"items": [
				{
					"type": "string"
				}
			]
		},
		"created": {
			"type": "string"
		},
		"edited": {
			"type": "string"
		},
		"url": {
			"type": "string"
		}
	},
	"required": [
		"name",
		"model",
		"manufacturer",
		"cost_in_credits",
		"length",
		"max_atmosphering_speed",
		"crew",
		"passengers",
		"cargo_capacity",
		"consumables",
		"vehicle_class",
		"pilots",
		"films",
		"created",
		"edited",
		"url"
	]
}
