{
  "name": "AT-TE",
  "model": "All Terrain Tactical Enforcer",
  "manufacturer": "Rothana Heavy Engineering, Kuat Drive Yards",
  "cost_in_credits": "unknown",
  "length": "13.2",
  "max_atmosphering_speed": "60",
  "crew": "6",
  "passengers": "36",
  "cargo_capacity": "10000",
  "consumables": "21 days",
  "vehicle_class": "walker",
  "pilots": [],
  "films": [
    "https://sw.simplr.sh/api/films/5.json",
    "https://sw.simplr.sh/api/films/6.json"
  ],
  "created": "2014-12-20T18:10:07.560000Z",
  "edited": "2014-12-20T21:30:21.728000Z",
  "url": "https://sw.simplr.sh/api/vehicles/53.json"
}
