{
  "name": "Imperial Speeder Bike",
  "model": "74-Z speeder bike",
  "manufacturer": "Aratech Repulsor Company",
  "cost_in_credits": "8000",
  "length": "3",
  "max_atmosphering_speed": "360",
  "crew": "1",
  "passengers": "1",
  "cargo_capacity": "4",
  "consumables": "1 day",
  "vehicle_class": "speeder",
  "pilots": [
    "https://sw.simplr.sh/api/people/1.json",
    "https://sw.simplr.sh/api/people/5.json"
  ],
  "films": ["https://sw.simplr.sh/api/films/3.json"],
  "created": "2014-12-18T11:20:04.625000Z",
  "edited": "2014-12-20T21:30:21.693000Z",
  "url": "https://sw.simplr.sh/api/vehicles/30.json"
}
