{
  "name": "Storm IV Twin-Pod cloud car",
  "model": "Storm IV Twin-Pod",
  "manufacturer": "Bespin Motors",
  "cost_in_credits": "75000",
  "length": "7",
  "max_atmosphering_speed": "1500",
  "crew": "2",
  "passengers": "0",
  "cargo_capacity": "10",
  "consumables": "1 day",
  "vehicle_class": "repulsorcraft",
  "pilots": [],
  "films": ["https://sw.simplr.sh/api/films/2.json"],
  "created": "2014-12-15T12:58:50.530000Z",
  "edited": "2014-12-20T21:30:21.681000Z",
  "url": "https://sw.simplr.sh/api/vehicles/20.json"
}
