{
  "name": "Oevvaor jet catamaran",
  "model": "Oevvaor jet catamaran",
  "manufacturer": "Appazanna Engineering Works",
  "cost_in_credits": "12125",
  "length": "15.1",
  "max_atmosphering_speed": "420",
  "crew": "2",
  "passengers": "2",
  "cargo_capacity": "50",
  "consumables": "3 days",
  "vehicle_class": "airspeeder",
  "pilots": [],
  "films": ["https://sw.simplr.sh/api/films/6.json"],
  "created": "2014-12-20T20:20:53.931000Z",
  "edited": "2014-12-20T21:30:21.756000Z",
  "url": "https://sw.simplr.sh/api/vehicles/69.json"
}
