{
  "name": "Koro-2 Exodrive airspeeder",
  "model": "Koro-2 Exodrive airspeeder",
  "manufacturer": "Desler Gizh Outworld Mobility Corporation",
  "cost_in_credits": "unknown",
  "length": "6.6",
  "max_atmosphering_speed": "800",
  "crew": "1",
  "passengers": "1",
  "cargo_capacity": "80",
  "consumables": "unknown",
  "vehicle_class": "airspeeder",
  "pilots": ["https://sw.simplr.sh/api/people/70.json"],
  "films": ["https://sw.simplr.sh/api/films/5.json"],
  "created": "2014-12-20T17:17:33.526000Z",
  "edited": "2014-12-20T21:30:21.716000Z",
  "url": "https://sw.simplr.sh/api/vehicles/45.json"
}
