{
  "name": "Geonosian starfighter",
  "model": "Nantex-class territorial defense",
  "manufacturer": "Huppla Pasa Tisc Shipwrights Collective",
  "cost_in_credits": "unknown",
  "length": "9.8",
  "max_atmosphering_speed": "20000",
  "crew": "1",
  "passengers": "0",
  "cargo_capacity": "unknown",
  "consumables": "unknown",
  "vehicle_class": "starfighter",
  "pilots": [],
  "films": ["https://sw.simplr.sh/api/films/5.json"],
  "created": "2014-12-20T18:34:12.541000Z",
  "edited": "2014-12-20T21:30:21.742000Z",
  "url": "https://sw.simplr.sh/api/vehicles/57.json"
}
