{
  "name": "Sand Crawler",
  "model": "Digger Crawler",
  "manufacturer": "Corellia Mining Corporation",
  "cost_in_credits": "150000",
  "length": "36.8 ",
  "max_atmosphering_speed": "30",
  "crew": "46",
  "passengers": "30",
  "cargo_capacity": "50000",
  "consumables": "2 months",
  "vehicle_class": "wheeled",
  "pilots": [],
  "films": [
    "https://sw.simplr.sh/api/films/1.json",
    "https://sw.simplr.sh/api/films/5.json"
  ],
  "created": "2014-12-10T15:36:25.724000Z",
  "edited": "2014-12-20T21:30:21.661000Z",
  "url": "https://sw.simplr.sh/api/vehicles/4.json"
}
