{
  "name": "Tsmeu-6 personal wheel bike",
  "model": "Tsmeu-6 personal wheel bike",
  "manufacturer": "Z-Gomot Ternbuell Guppat Corporation",
  "cost_in_credits": "15000",
  "length": "3.5",
  "max_atmosphering_speed": "330",
  "crew": "1",
  "passengers": "1",
  "cargo_capacity": "10",
  "consumables": "none",
  "vehicle_class": "wheeled walker",
  "pilots": ["https://sw.simplr.sh/api/people/79.json"],
  "films": ["https://sw.simplr.sh/api/films/6.json"],
  "created": "2014-12-20T19:43:54.870000Z",
  "edited": "2014-12-20T21:30:21.745000Z",
  "url": "https://sw.simplr.sh/api/vehicles/60.json"
}
