{
  "name": "X-34 landspeeder",
  "model": "X-34 landspeeder",
  "manufacturer": "SoroSuub Corporation",
  "cost_in_credits": "10550",
  "length": "3.4 ",
  "max_atmosphering_speed": "250",
  "crew": "1",
  "passengers": "1",
  "cargo_capacity": "5",
  "consumables": "unknown",
  "vehicle_class": "repulsorcraft",
  "pilots": [],
  "films": ["https://sw.simplr.sh/api/films/1.json"],
  "created": "2014-12-10T16:13:52.586000Z",
  "edited": "2014-12-20T21:30:21.668000Z",
  "url": "https://sw.simplr.sh/api/vehicles/7.json"
}
