{
  "name": "Multi-Troop Transport",
  "model": "Multi-Troop Transport",
  "manufacturer": "Baktoid Armor Workshop",
  "cost_in_credits": "138000",
  "length": "31",
  "max_atmosphering_speed": "35",
  "crew": "4",
  "passengers": "112",
  "cargo_capacity": "12000",
  "consumables": "unknown",
  "vehicle_class": "repulsorcraft",
  "pilots": [],
  "films": ["https://sw.simplr.sh/api/films/4.json"],
  "created": "2014-12-19T17:12:04.400000Z",
  "edited": "2014-12-20T21:30:21.700000Z",
  "url": "https://sw.simplr.sh/api/vehicles/34.json"
}
