{
  "name": "AT-ST",
  "model": "All Terrain Scout Transport",
  "manufacturer": "Kuat Drive Yards, Imperial Department of Military Research",
  "cost_in_credits": "unknown",
  "length": "2",
  "max_atmosphering_speed": "90",
  "crew": "2",
  "passengers": "0",
  "cargo_capacity": "200",
  "consumables": "none",
  "vehicle_class": "walker",
  "pilots": ["https://sw.simplr.sh/api/people/13.json"],
  "films": [
    "https://sw.simplr.sh/api/films/2.json",
    "https://sw.simplr.sh/api/films/3.json"
  ],
  "created": "2014-12-15T12:46:42.384000Z",
  "edited": "2014-12-20T21:30:21.679000Z",
  "url": "https://sw.simplr.sh/api/vehicles/19.json"
}
