{
  "name": "XJ-6 airspeeder",
  "model": "XJ-6 airspeeder",
  "manufacturer": "Narglatch AirTech prefabricated kit",
  "cost_in_credits": "unknown",
  "length": "6.23",
  "max_atmosphering_speed": "720",
  "crew": "1",
  "passengers": "1",
  "cargo_capacity": "unknown",
  "consumables": "unknown",
  "vehicle_class": "airspeeder",
  "pilots": ["https://sw.simplr.sh/api/people/11.json"],
  "films": ["https://sw.simplr.sh/api/films/5.json"],
  "created": "2014-12-20T17:19:19.991000Z",
  "edited": "2014-12-20T21:30:21.719000Z",
  "url": "https://sw.simplr.sh/api/vehicles/46.json"
}
